{
  "schema_version": "0.2.0",
  "dataset_id": "context-producer-proof-v02",
  "evidence_schema_version": "0.1.0",
  "artifacts": [
    {
      "id": "codex:ed93bb0108475237",
      "harness": "codex",
      "format": "codex-rollout-jsonl",
      "version": "0.153.4",
      "sha256": "ed93bb0108475237658bf3790203c301a24b4d7e6d7614d2e8e73e399104cf5a",
      "coverage": "partial",
      "description": "Codex rollout JSONL with additive response usage and legacy token snapshots."
    }
  ],
  "profiles": [
    {
      "schema_version": "0.2.0",
      "id": "harness-profile:0bef064ea349091c20a47641971a90bab9f8a22f07670e57ef2b91f9487297da",
      "name": "Codex root-accounting accounting profile",
      "harness": "codex",
      "harness_version": {
        "value": "0.153.4",
        "evidence": "observed",
        "source_refs": [
          {
            "source_id": "codex:ed93bb0108475237",
            "record": "line:1/payload/cli_version"
          }
        ]
      },
      "profile_version": "0.2.0",
      "model": {
        "provider": {
          "value": null,
          "evidence": "unknown",
          "source_refs": []
        },
        "name": {
          "value": "gpt-6-astra",
          "evidence": "observed",
          "source_refs": [
            {
              "source_id": "codex:ed93bb0108475237",
              "record": "line:61/payload/model"
            }
          ]
        },
        "settings": {
          "effort": {
            "value": "high",
            "evidence": "observed",
            "source_refs": [
              {
                "source_id": "codex:ed93bb0108475237",
                "record": "line:61/payload/model"
              }
            ]
          }
        }
      },
      "instruction_sources": [],
      "tools": [],
      "policies": {
        "assembly": {
          "value": null,
          "evidence": "unknown",
          "source_refs": []
        },
        "truncation": {
          "value": null,
          "evidence": "unknown",
          "source_refs": []
        },
        "compaction": {
          "value": null,
          "evidence": "unknown",
          "source_refs": []
        },
        "caching": {
          "value": null,
          "evidence": "unknown",
          "source_refs": []
        }
      },
      "context_capabilities": [
        {
          "origin": "system_instruction",
          "capture": "unknown",
          "evidence": "unknown",
          "source_refs": [],
          "note": "No capture capability has been established for this profile."
        },
        {
          "origin": "developer_instruction",
          "capture": "unknown",
          "evidence": "unknown",
          "source_refs": [],
          "note": "No capture capability has been established for this profile."
        },
        {
          "origin": "user_prompt",
          "capture": "unknown",
          "evidence": "unknown",
          "source_refs": [],
          "note": "No capture capability has been established for this profile."
        },
        {
          "origin": "repository_instruction",
          "capture": "unknown",
          "evidence": "unknown",
          "source_refs": [],
          "note": "No capture capability has been established for this profile."
        },
        {
          "origin": "skill",
          "capture": "unknown",
          "evidence": "unknown",
          "source_refs": [],
          "note": "No capture capability has been established for this profile."
        },
        {
          "origin": "repository_file",
          "capture": "unknown",
          "evidence": "unknown",
          "source_refs": [],
          "note": "No capture capability has been established for this profile."
        },
        {
          "origin": "retrieved_document",
          "capture": "unknown",
          "evidence": "unknown",
          "source_refs": [],
          "note": "No capture capability has been established for this profile."
        },
        {
          "origin": "tool_result",
          "capture": "unknown",
          "evidence": "unknown",
          "source_refs": [],
          "note": "No capture capability has been established for this profile."
        },
        {
          "origin": "tool_schema",
          "capture": "unknown",
          "evidence": "unknown",
          "source_refs": [],
          "note": "No capture capability has been established for this profile."
        },
        {
          "origin": "output_schema",
          "capture": "unknown",
          "evidence": "unknown",
          "source_refs": [],
          "note": "No capture capability has been established for this profile."
        },
        {
          "origin": "conversation_history",
          "capture": "unknown",
          "evidence": "unknown",
          "source_refs": [],
          "note": "No capture capability has been established for this profile."
        },
        {
          "origin": "assistant_output",
          "capture": "unknown",
          "evidence": "unknown",
          "source_refs": [],
          "note": "No capture capability has been established for this profile."
        },
        {
          "origin": "memory",
          "capture": "unknown",
          "evidence": "unknown",
          "source_refs": [],
          "note": "No capture capability has been established for this profile."
        },
        {
          "origin": "delegated_context",
          "capture": "unknown",
          "evidence": "unknown",
          "source_refs": [],
          "note": "No capture capability has been established for this profile."
        },
        {
          "origin": "attachment",
          "capture": "unknown",
          "evidence": "unknown",
          "source_refs": [],
          "note": "No capture capability has been established for this profile."
        },
        {
          "origin": "unknown",
          "capture": "unknown",
          "evidence": "unknown",
          "source_refs": [],
          "note": "No capture capability has been established for this profile."
        }
      ],
      "artifacts": [
        {
          "id": "codex:ed93bb0108475237",
          "harness": "codex",
          "format": "codex-rollout-jsonl",
          "version": "0.153.4",
          "sha256": "ed93bb0108475237658bf3790203c301a24b4d7e6d7614d2e8e73e399104cf5a",
          "coverage": "partial",
          "description": "Codex rollout JSONL with additive response usage and legacy token snapshots."
        }
      ]
    }
  ],
  "sources": [],
  "revisions": [],
  "requests": [
    {
      "id": "native-request:codex:codex:capture:observation:b941d9cee41e9714ca2858f5bae353b0",
      "observation_id": "codex:capture:observation:b941d9cee41e9714ca2858f5bae353b0",
      "profile_id": "harness-profile:0bef064ea349091c20a47641971a90bab9f8a22f07670e57ef2b91f9487297da",
      "captured_at": null,
      "boundary": "unavailable",
      "coverage": "unknown",
      "coverage_evidence": "unknown",
      "occurrences": [],
      "overrides": {},
      "source_refs": [
        {
          "source_id": "codex:ed93bb0108475237",
          "record": "response:sha256:c4a47a21e6e8c3f08dc69eefb57e434ec7d010b0d13ceed6bec580756129924a:line:3"
        }
      ]
    },
    {
      "id": "native-request:codex:codex:capture:observation:077c7bcf5723df1010350380e5913426",
      "observation_id": "codex:capture:observation:077c7bcf5723df1010350380e5913426",
      "profile_id": "harness-profile:0bef064ea349091c20a47641971a90bab9f8a22f07670e57ef2b91f9487297da",
      "captured_at": null,
      "boundary": "unavailable",
      "coverage": "unknown",
      "coverage_evidence": "unknown",
      "occurrences": [],
      "overrides": {},
      "source_refs": [
        {
          "source_id": "codex:ed93bb0108475237",
          "record": "response:sha256:1700c95f87487974fddac2bc8ace1bdffd3ce6468c6ecfc40c2f7249d0eab48e:line:5"
        }
      ]
    },
    {
      "id": "native-request:codex:codex:capture:observation:587f943c181f9e237771b3e916f6b081",
      "observation_id": "codex:capture:observation:587f943c181f9e237771b3e916f6b081",
      "profile_id": "harness-profile:0bef064ea349091c20a47641971a90bab9f8a22f07670e57ef2b91f9487297da",
      "captured_at": null,
      "boundary": "unavailable",
      "coverage": "unknown",
      "coverage_evidence": "unknown",
      "occurrences": [],
      "overrides": {},
      "source_refs": [
        {
          "source_id": "codex:ed93bb0108475237",
          "record": "response:sha256:9a590ef0870a1336e38868483ace750f7bd27b8241d436ad1eb39530d939406f:line:7"
        }
      ]
    },
    {
      "id": "native-request:codex:codex:capture:observation:d22c068149e0d08044a32405dec0ba43",
      "observation_id": "codex:capture:observation:d22c068149e0d08044a32405dec0ba43",
      "profile_id": "harness-profile:0bef064ea349091c20a47641971a90bab9f8a22f07670e57ef2b91f9487297da",
      "captured_at": null,
      "boundary": "unavailable",
      "coverage": "unknown",
      "coverage_evidence": "unknown",
      "occurrences": [],
      "overrides": {},
      "source_refs": [
        {
          "source_id": "codex:ed93bb0108475237",
          "record": "response:sha256:308d934a30c9f47f9184575e834e32a2c3355dec4d89463074a06035923f2ba5:line:9"
        }
      ]
    },
    {
      "id": "native-request:codex:codex:capture:observation:b2e5d6d552c28d683af1ba2457a73080",
      "observation_id": "codex:capture:observation:b2e5d6d552c28d683af1ba2457a73080",
      "profile_id": "harness-profile:0bef064ea349091c20a47641971a90bab9f8a22f07670e57ef2b91f9487297da",
      "captured_at": null,
      "boundary": "unavailable",
      "coverage": "unknown",
      "coverage_evidence": "unknown",
      "occurrences": [],
      "overrides": {},
      "source_refs": [
        {
          "source_id": "codex:ed93bb0108475237",
          "record": "response:sha256:627cff1a1a649e33f2f66ff47a03d092f981b1db007ebf307b3a4ed634170c23:line:11"
        }
      ]
    },
    {